[
  {
    "created_at": "2026-10-06T00:11:27.334438614Z",
    "id": "op-47a1b8480bca4187",
    "intent": {
      "expected_head_sha": "5c8afed4c2b5e150bb52c29de6eb15d76acee709"
    },
    "kind": "merge",
    "outcome": {
      "base": "b19372038e024209d98781b9de07ee9f41393b46",
      "called": false,
      "tree": "ed76ecb372c99fad7dd41144a545689113032581",
      "withdrawn": "the base main moved from 7a89a6d2ac2eb6ed8fa9ce40e778b4d21b4d1dba to b19372038e024209d98781b9de07ee9f41393b46; the evidence covers tree 7ac394c3a02f149443dab9d788856cd284dc2677, but ed76ecb372c99fad7dd41144a545689113032581 is what would land"
    },
    "state": "failed",
    "task_id": "fix-add",
    "updated_at": "2026-10-06T00:11:27.812210431Z"
  },
  {
    "created_at": "2026-10-06T00:11:27.455992005Z",
    "id": "op-351889ac93e54917",
    "intent": {
      "base": "main",
      "expected_head_sha": "5c8afed4c2b5e150bb52c29de6eb15d76acee709"
    },
    "kind": "open_pr",
    "outcome": {
      "seen": {
        "errors": [],
        "observation": {
          "detail": {
            "auto_merge": false,
            "head": "5c8afed4c2b5e150bb52c29de6eb15d76acee709",
            "number": 1,
            "state": "open"
          },
          "seen": "pr"
        }
      },
      "verdict": {
        "verdict": "confirmed"
      }
    },
    "state": "confirmed",
    "task_id": "fix-add",
    "updated_at": "2026-10-06T00:11:27.667424717Z"
  }
]