[
  {
    "created_at": "2026-10-06T01:12:24.536440747Z",
    "id": "op-eccbb2747d6d4332",
    "intent": {
      "base": "main",
      "expected_head_sha": "99b1318094d72a1e9a68177e81643ba480dbb240",
      "pull_request": 1
    },
    "kind": "merge",
    "outcome": {
      "seen": {
        "observation": {
          "detail": {
            "auto_merge": false,
            "base_branch": "main",
            "head": "99b1318094d72a1e9a68177e81643ba480dbb240",
            "landed": {
              "on_base": true,
              "onto": "2e55f28c984262f31ed6134243ce42daa3ae4f00",
              "tree": "c1c732b6753816fd2693e0cd2d2d50ffbd8cc7af"
            },
            "merged_at": "2026-10-06T01:12:24.947666Z",
            "number": 1,
            "state": "merged"
          },
          "seen": "pr"
        },
        "reconciled": true
      },
      "verdict": {
        "merged_at": "2026-10-06T01:12:24.947666Z",
        "report": {
          "head_sha": "99b1318094d72a1e9a68177e81643ba480dbb240",
          "outcome": "merged"
        },
        "verdict": "land"
      }
    },
    "state": "confirmed",
    "task_id": "fix-add",
    "updated_at": "2026-10-06T01:12:25.227830749Z"
  },
  {
    "created_at": "2026-10-06T01:12:24.629959153Z",
    "id": "op-f7bc20f091d941ee",
    "intent": {
      "base": "main",
      "expected_head_sha": "99b1318094d72a1e9a68177e81643ba480dbb240"
    },
    "kind": "open_pr",
    "outcome": {
      "seen": {
        "errors": [],
        "observation": {
          "detail": {
            "auto_merge": false,
            "base_branch": "main",
            "head": "99b1318094d72a1e9a68177e81643ba480dbb240",
            "landed": null,
            "merged_at": null,
            "number": 1,
            "state": "open"
          },
          "seen": "pr"
        }
      },
      "verdict": {
        "verdict": "confirmed"
      }
    },
    "state": "confirmed",
    "task_id": "fix-add",
    "updated_at": "2026-10-06T01:12:24.796849096Z"
  }
]