[
  {
    "created_at": "2026-10-06T01:11:56.585538295Z",
    "id": "op-6b5c893d3f71420c",
    "intent": {
      "base": "main",
      "expected_head_sha": "b76ef6e302f4a52a6ceee68aa80094da6ff1c920",
      "pull_request": 1
    },
    "kind": "merge",
    "outcome": {
      "seen": {
        "call": "ok",
        "observation": {
          "detail": {
            "auto_merge": false,
            "base_branch": "main",
            "head": "b76ef6e302f4a52a6ceee68aa80094da6ff1c920",
            "landed": {
              "on_base": true,
              "onto": "c4975679de46756d924dada7b88acfab1885e527",
              "tree": "7ac394c3a02f149443dab9d788856cd284dc2677"
            },
            "merged_at": "2026-10-06T01:11:57.148656Z",
            "number": 1,
            "state": "merged"
          },
          "seen": "pr"
        }
      },
      "verdict": {
        "merged_at": "2026-10-06T01:11:57.148656Z",
        "report": {
          "head_sha": "b76ef6e302f4a52a6ceee68aa80094da6ff1c920",
          "outcome": "merged"
        },
        "verdict": "land"
      }
    },
    "state": "confirmed",
    "task_id": "fix-add",
    "updated_at": "2026-10-06T01:11:57.389574605Z"
  },
  {
    "created_at": "2026-10-06T01:11:56.714509847Z",
    "id": "op-bc0ac4e7408648f6",
    "intent": {
      "base": "main",
      "expected_head_sha": "b76ef6e302f4a52a6ceee68aa80094da6ff1c920"
    },
    "kind": "open_pr",
    "outcome": {
      "seen": {
        "errors": [],
        "observation": {
          "detail": {
            "auto_merge": false,
            "base_branch": "main",
            "head": "b76ef6e302f4a52a6ceee68aa80094da6ff1c920",
            "landed": null,
            "merged_at": null,
            "number": 1,
            "state": "open"
          },
          "seen": "pr"
        }
      },
      "verdict": {
        "verdict": "confirmed"
      }
    },
    "state": "confirmed",
    "task_id": "fix-add",
    "updated_at": "2026-10-06T01:11:56.971546201Z"
  }
]